productType,categories,variantId,sku,key,slug.en,brand,name.en,metaTitle.en,metaDescription.en,metaKeywords.en,description.en,age-range,prices,images
main,Games>Board games,1,BG5,BG5,BG5,moulinroty,4 seasons mini puzzles La Grande Famille,,,,"Nini the pretty little mouse, Sylvain the cheeky rabbit, Blanche, a graceful and charming doe — this joyous band has got together to delight the little ones!

Let's find out about the seasons! Early learning set containing 4 mini jigsaws with 12 pieces, featuring illustrations of the cheerful characters in the Grande Famille. Each jigsaw comes with a poster to help children complete it easily.
Not washable.",3-6,EUR 1600;US-USD 1800,https://raw.githubusercontent.com/haslie22/kiddo-kingdom-data/data/images/games/board-games/BG1-1.jpeg;https://raw.githubusercontent.com/haslie22/kiddo-kingdom-data/data/images/games/board-games/BG1-2.jpeg;https://raw.githubusercontent.com/haslie22/kiddo-kingdom-data/data/images/games/board-games/BG1-3.jpeg;https://raw.githubusercontent.com/haslie22/kiddo-kingdom-data/data/images/games/board-games/BG1-4.jpeg
main,Games>Board games,1,BG6,BG6,BG6,moulinroty,Cubes,,,,"A 2-in-1 early learning game for toddlers, both a puzzle and a construction game. Flip the 6 cubes over to put together the funny portraits of the animals from Les Toupitis collection. Wooden blocks that are easy to handle. + 18 months old
Washable with a soft and damp cloth.",0-3,EUR 1900;US-USD 2100,https://raw.githubusercontent.com/haslie22/kiddo-kingdom-data/data/images/games/board-games/BG2-1.jpeg;https://raw.githubusercontent.com/haslie22/kiddo-kingdom-data/data/images/games/board-games/BG2-2.jpeg;https://raw.githubusercontent.com/haslie22/kiddo-kingdom-data/data/images/games/board-games/BG2-3.jpeg;https://raw.githubusercontent.com/haslie22/kiddo-kingdom-data/data/images/games/board-games/BG2-4.jpeg
main,Games>Board games,1,BG7,BG7,BG7,moulinroty,Magnetic game Shapes Les Popipop,,,,"Magnetic game with cardboard shapes in primary colours. Use the different- shaped magnets to recreate the pictures illustrated on the 20 cards: train, yacht, kite, flower etc.
Not washable.",3-6,EUR 2300;US-USD 2600,https://raw.githubusercontent.com/haslie22/kiddo-kingdom-data/data/images/games/board-games/BG3-1.jpeg;https://raw.githubusercontent.com/haslie22/kiddo-kingdom-data/data/images/games/board-games/BG3-2.jpeg;https://raw.githubusercontent.com/haslie22/kiddo-kingdom-data/data/images/games/board-games/BG3-3.jpeg;https://raw.githubusercontent.com/haslie22/kiddo-kingdom-data/data/images/games/board-games/BG3-4.jpeg
main,Games>Card games,1,CG1,CG1,CG1,maisonpatate,26 Cards Alphabet,,,,"French brand MAISON PATATE has created 26 beautiful alphabet cards to help your little ones learn not only letters but also sign language.
Each card has a letter on the front and 4 ways to write it on the reverse side - in print, in script and in uppercase and lowercase. Each word, each colour has been carefully chosen and hand-painted by the talented artist Marie Pellet.
Learning becomes play. It will also be possible to make names, words, ... and easier to remember.

You can take these cards with you everywhere in a beautiful eco-cotton bag.
26 illustrated cards from A to Z on the front and back.
Printed in France on 350gsm laminated cardboard",3-6,EUR 2500;US-USD 2800,https://raw.githubusercontent.com/haslie22/kiddo-kingdom-data/data/images/games/card-games/CG1-1.jpeg;https://raw.githubusercontent.com/haslie22/kiddo-kingdom-data/data/images/games/card-games/CG1-2.jpeg;https://raw.githubusercontent.com/haslie22/kiddo-kingdom-data/data/images/games/card-games/CG1-3.jpeg;https://raw.githubusercontent.com/haslie22/kiddo-kingdom-data/data/images/games/card-games/CG1-4.jpeg
main,Games>Card games,1,CG2,CG2,CG2,lesminimondes,Memory,,,,"The legendary Memory game is coming to Les Mini Mondes!

Designed to suit the age of your child, the object of the game is to find the pairs of cards. You can also complicate things by completing the requested challenges.
The Maxi Memory of the world follows the evolution of your little player:

Touminis level: arrange the cards in the right place
Minis level: arrange the cards upside down
And for more challenges, complete the associated challenges
A Mini Worlds-style Memory game is MAXI Memory. 80 cards divided into 4 main themes: animals, music, food and friends of the world.",3-6,EUR 1600;US-USD 1800,https://raw.githubusercontent.com/haslie22/kiddo-kingdom-data/data/images/games/card-games/CG2-1.jpeg;https://raw.githubusercontent.com/haslie22/kiddo-kingdom-data/data/images/games/card-games/CG2-2.jpeg;https://raw.githubusercontent.com/haslie22/kiddo-kingdom-data/data/images/games/card-games/CG2-3.jpeg;https://raw.githubusercontent.com/haslie22/kiddo-kingdom-data/data/images/games/card-games/CG2-4.jpeg
main,Games>Educational games,1,EG1,EG1,EG1,crealign,Animals of the savannah,,,,"Thanks to the accordion folding technique, children will be able to create pretty savannah animals by folding the printed strips of paper, and thus bring them to life by assembling them!",6-12,EUR 1000;US-USD 1200,https://raw.githubusercontent.com/haslie22/kiddo-kingdom-data/data/images/games/educational-games/EG1-1.png;https://raw.githubusercontent.com/haslie22/kiddo-kingdom-data/data/images/games/educational-games/EG1-2.png;https://raw.githubusercontent.com/haslie22/kiddo-kingdom-data/data/images/games/educational-games/EG1-3.png;https://raw.githubusercontent.com/haslie22/kiddo-kingdom-data/data/images/games/educational-games/EG1-4.png
main,Games>Educational games,1,EG2,EG2,EG2,crealign,Relief portraits Pets,,,,"To assemble and compose pets thanks to the thick, self-adhesive pre-cut foam pieces.

Children can reproduce their favorite animals and then display their works on the pretty easel provided.

5 sheets of foam stickers, 5 cards, 1 easel and a step-by-step guide.",6-12,EUR 1800;US-USD 2000,https://raw.githubusercontent.com/haslie22/kiddo-kingdom-data/data/images/games/educational-games/EG2-1.jpeg;https://raw.githubusercontent.com/haslie22/kiddo-kingdom-data/data/images/games/educational-games/EG2-2.jpeg;https://raw.githubusercontent.com/haslie22/kiddo-kingdom-data/data/images/games/educational-games/EG2-3.jpeg;https://raw.githubusercontent.com/haslie22/kiddo-kingdom-data/data/images/games/educational-games/EG2-4.jpeg
main,Games>Educational games,1,EG3,EG3,EG3,crealign,Relief portraits Animals of the savannah,,,,"To assemble and compose pets thanks to the thick, self-adhesive pre-cut foam pieces.

Children can reproduce their favorite animals and then display their works on the pretty easel provided.

5 sheets of foam stickers, 5 cards, 1 easel and a step-by-step guide.",6-12,EUR 1800;US-USD 2000,https://raw.githubusercontent.com/haslie22/kiddo-kingdom-data/data/images/games/educational-games/EG3-1.jpeg;https://raw.githubusercontent.com/haslie22/kiddo-kingdom-data/data/images/games/educational-games/EG3-2.jpeg;https://raw.githubusercontent.com/haslie22/kiddo-kingdom-data/data/images/games/educational-games/EG3-3.jpeg;https://raw.githubusercontent.com/haslie22/kiddo-kingdom-data/data/images/games/educational-games/EG3-4.jpeg
main,Games>Educational games,1,EG4,EG4,EG4,crealign,Laine à lacer Douceur des Bois,,,,"A box that will amaze children!
Thanks to the lacing cards and the pretty yarn, the children will create soft animal furs.
This creative activity will allow children to develop their dexterity while having fun.

Contains 5 cards of 18 x 18 cm format in thick cardboard with a bear, a fox, a squirrel, a raccoon and a wolf.
3 red strands of wool
3 light brown strands of wool
4 dark brown strands of wool
Length of the strands 80 cm
A sticker board to hold the wool on the back of the card",6-12,EUR 1900;US-USD 2100,https://raw.githubusercontent.com/haslie22/kiddo-kingdom-data/data/images/games/educational-games/EG4-1.jpeg;https://raw.githubusercontent.com/haslie22/kiddo-kingdom-data/data/images/games/educational-games/EG4-2.jpeg;https://raw.githubusercontent.com/haslie22/kiddo-kingdom-data/data/images/games/educational-games/EG4-3.jpeg;https://raw.githubusercontent.com/haslie22/kiddo-kingdom-data/data/images/games/educational-games/EG4-4.jpeg
main,Games>Educational games,1,EG5,EG5,EG5,crealign,Cards to create Glittering fairies,,,,"Kids can embellish and sparkle the cards using the glitter shapes and glitter ink pens.

They can then offer them or present them on the pretty easel provided.

6 cards, 5 sheets of sparkly shapes, 3 glitter ink pens and an easel",6-12,EUR 2000;US-USD 2300,https://raw.githubusercontent.com/haslie22/kiddo-kingdom-data/data/images/games/educational-games/EG5-1.jpeg;https://raw.githubusercontent.com/haslie22/kiddo-kingdom-data/data/images/games/educational-games/EG5-2.jpeg;https://raw.githubusercontent.com/haslie22/kiddo-kingdom-data/data/images/games/educational-games/EG5-3.jpeg;https://raw.githubusercontent.com/haslie22/kiddo-kingdom-data/data/images/games/educational-games/EG5-4.jpeg
main,Games>Educational games,1,EG6,EG6,EG6,crealign,3D Decorative animals Fantastic Diamonds,,,,"Assemble and embellish your fantastic animals using colored diamonds.

You will get beautiful sparkling characters that will decorate your desk or your shelves.

3 characters and 495 self-adhesive diamonds",6-12,EUR 2000;US-USD 2300,https://raw.githubusercontent.com/haslie22/kiddo-kingdom-data/data/images/games/educational-games/EG6-1.jpeg;https://raw.githubusercontent.com/haslie22/kiddo-kingdom-data/data/images/games/educational-games/EG6-2.jpeg;https://raw.githubusercontent.com/haslie22/kiddo-kingdom-data/data/images/games/educational-games/EG6-3.jpeg;https://raw.githubusercontent.com/haslie22/kiddo-kingdom-data/data/images/games/educational-games/EG6-4.jpeg
main,Games>Railways,1,GR1,GR1,GR1,brioworld,33052 Deluxe Railway Set,,,,"The Deluxe Railway Set is an action-packed train set that includes passenger trains, freight trains, harbour scenes and metro fun. It’s complete with stations, cranes, bridges and figures. A must have for any train lover.

Perfect for the creative toddler - Start your budding train engineer off on the right track with a Deluxe Railway wooden toy train set. It’s the perfect gift at Christmas or over the holiday season for the creative toddler - designed for ages 3 and up, with batteries included.

As your child develops, so can their railway play as the 33052 Deluxe Railway Set is compatible with all other BRIO railway toys.

Playing with train sets helps children to understand and learn about their environment in a fun way.

We conduct more than 1,000 safety tests a year to ensure that our products conform to all safety standards, and we take pride in developing toys that are completely safe for children to play with.",6-12,EUR 40900;US-USD 45000,https://raw.githubusercontent.com/haslie22/kiddo-kingdom-data/data/images/games/railways/GR1-1.jpg;https://raw.githubusercontent.com/haslie22/kiddo-kingdom-data/data/images/games/railways/GR1-2.jpg;https://raw.githubusercontent.com/haslie22/kiddo-kingdom-data/data/images/games/railways/GR1-3.jpg;https://raw.githubusercontent.com/haslie22/kiddo-kingdom-data/data/images/games/railways/GR1-4.jpg
main,Games>Railways,1,GR2,GR2,GR2,brioworld,33097 Cargo Railway Deluxe Set,,,,"The cargo railway deluxe set comes with 54 pieces; two trains, a battery powered engine, 3 cranes, a truck, cargo, bridge, rocks and crossing signal. Batteries not included.

Start your budding train engineer off on the right track with a BRIO cargo railway deluxe set toy train, tracks and accessories. It's the perfect gift for the creative toddler - designed for ages 3 and up.

As your child develops, so can their railway play as the 33097 cargo railway deluxe set is compatible with all other BRIO railway toys.

Playing with train sets helps children to understand and learn about their environment in a fun way.

We conduct more than 1,000 safety tests a year to ensure that our products conform to all safety standards, and we take pride in developing toys that are completely safe for children to play with.",6-12,EUR 19900;US-USD 21900,https://raw.githubusercontent.com/haslie22/kiddo-kingdom-data/data/images/games/railways/GR2-1.jpg;https://raw.githubusercontent.com/haslie22/kiddo-kingdom-data/data/images/games/railways/GR2-2.jpg;https://raw.githubusercontent.com/haslie22/kiddo-kingdom-data/data/images/games/railways/GR2-3.jpg;https://raw.githubusercontent.com/haslie22/kiddo-kingdom-data/data/images/games/railways/GR2-4.jpg
main,Games>Railways,1,GR3,GR3,GR3,brioworld,33887 Lift & Load Warehouse Set,,,,"The Lift & Load Warehouse Set is a 32 piece train set that includes a 4-level elevator, vehicles, tracks and everything you need for a lift and load station. It's complete with supports, bridges and figures. A must have for any train lover.

Start your budding engineer off on the right track or expand your collection with the Lift & Load Warehouse Set. It’s the perfect gift at Christmas or over the holiday season for the creative toddler - designed for ages 3 and up.

As your child develops, so can their railway play as the Lift & Load Warehouse Set is compatible with all other BRIO railway toys.

Playing with train sets helps children to understand and learn about their environment in a fun way.

We conduct more than 1,000 safety tests a year to ensure that our products conform to all safety standards, and we take pride in developing toys that are completely safe for children to play with.",6-12,EUR 12400;US-USD 13700,https://raw.githubusercontent.com/haslie22/kiddo-kingdom-data/data/images/games/railways/GR3-1.jpg;https://raw.githubusercontent.com/haslie22/kiddo-kingdom-data/data/images/games/railways/GR3-2.jpg;https://raw.githubusercontent.com/haslie22/kiddo-kingdom-data/data/images/games/railways/GR3-3.jpg;https://raw.githubusercontent.com/haslie22/kiddo-kingdom-data/data/images/games/railways/GR3-4.jpg
main,Games>Railways,1,GR4,GR4,GR4,brioworld,33766 Railway World Deluxe Set,,,,"This ultimate Brio world railway set includes trains, tracks, automobiles, figures, bridges, crane, stations, destinations, farm with animals, Lighthouse and ferry with light and sound effects, and even an airport with plane and runway.

Start your budding train engineer off on the right track with a Brio railway world deluxe wooden toy train set. It's the perfect gift for the creative toddler - designed for ages 3 and up.

As your child develops, so can their railway play as the 33766 railway world deluxe set is compatible with all other Brio railway toys.

Playing with train sets helps children to understand and learn about their environment in a fun way.

We conduct more than 1, 000 safety tests a year to ensure that our products conform to all safety standards, and we take pride in developing toys that are completely safe for children to play with.",6-12,EUR 37700;US-USD 41500,https://raw.githubusercontent.com/haslie22/kiddo-kingdom-data/data/images/games/railways/GR4-1.jpg;https://raw.githubusercontent.com/haslie22/kiddo-kingdom-data/data/images/games/railways/GR4-2.jpg;https://raw.githubusercontent.com/haslie22/kiddo-kingdom-data/data/images/games/railways/GR4-3.jpg;https://raw.githubusercontent.com/haslie22/kiddo-kingdom-data/data/images/games/railways/GR4-4.jpg
main,Games>Railways,1,GR5,GR5,GR5,brioworld,33513 Metro Railway Set,,,,"The Metro Railway Set comes with 20 pieces including a light and sounds train engine, two passenger cars with sliding doors, a ticket kiosk, metro map, and two passengers. Batteries included.

Start your budding train engineer off on the right track with a BRIO Metro Railway Set toy train, tracks and accessories. It’s the perfect gift at Christmas or over the holiday season for the creative toddler - designed for ages 3 and up.

As your child develops, so can their railway play as the 33513 Metro Railway Set is compatible with all other BRIO railway toys.

Playing with train sets helps children to understand and learn about their environment in a fun way.

We conduct more than 1,000 safety tests a year to ensure that our products conform to all safety standards, and we take pride in developing toys that are completely safe for children to play with.",6-12,EUR 8900;US-USD 9800,https://raw.githubusercontent.com/haslie22/kiddo-kingdom-data/data/images/games/railways/GR5-1.jpg;https://raw.githubusercontent.com/haslie22/kiddo-kingdom-data/data/images/games/railways/GR5-2.jpg;https://raw.githubusercontent.com/haslie22/kiddo-kingdom-data/data/images/games/railways/GR5-3.jpg;https://raw.githubusercontent.com/haslie22/kiddo-kingdom-data/data/images/games/railways/GR5-4.jpg
main,Games>Railways,1,GR6,GR6,GR6,brioworld,33028 Classic Figure 8 Set,,,,"The Classic Figure 8 Set comes with 22 pieces including 1 engine, 2 wagons, 14 tracks, 1 crossing bridge, 1 BRIO train station and 3 trees, all in classic wooden style.

Start your budding train engineer off on the right track with a Classic Figure 8 Set. It’s the perfect gift at Christmas or over the holiday season for the creative toddler - designed for ages 2 and up.

As your child develops, so can their railway play as the Classic Figure 8 Set is compatible with all other BRIO railway toys.

Playing with train sets helps children to understand and learn about their environment in a fun way, whilst also developing their fine motor skills.

Nothing is more important to us than safety. We know that children sometimes play with toys in other ways than expected, and that’s why we test our products thoroughly. We set very strict safety requirements, and in many cases our own testing is tougher than the legal requirements.
",6-12,EUR 7900;US-USD 8700,https://raw.githubusercontent.com/haslie22/kiddo-kingdom-data/data/images/games/railways/GR6-1.jpg;https://raw.githubusercontent.com/haslie22/kiddo-kingdom-data/data/images/games/railways/GR6-2.jpg;https://raw.githubusercontent.com/haslie22/kiddo-kingdom-data/data/images/games/railways/GR6-3.jpg;https://raw.githubusercontent.com/haslie22/kiddo-kingdom-data/data/images/games/railways/GR6-4.jpg
main,Games>Railways,1,GR7,GR7,GR7,brioworld,33815 Rescue Firefighter Set,,,,"The Firefighter Set comes with 18 pieces including a fire train with fire hose wagon, docking station, firefighter figure, fire truck with light and sound, and more.

Start your budding train engineer off on the right track with a BRIO Firefighter Set toy train, tracks and accessories. It’s the perfect gift at Christmas or over the holiday season for the creative toddler - designed for ages 3 and up.

As your child develops, so can their railway play as the 33815 Firefighter Set is compatible with all other BRIO railway toys.

Playing with train sets helps children to understand and learn about their environment in a fun way.

We conduct more than 1, 000 safety tests a year to ensure that our products conform to all safety standards, and we take pride in developing toys that are completely safe for children to play with.",6-12,EUR 6000;US-USD 6700,https://raw.githubusercontent.com/haslie22/kiddo-kingdom-data/data/images/games/railways/GR7-1.jpg;https://raw.githubusercontent.com/haslie22/kiddo-kingdom-data/data/images/games/railways/GR7-2.jpg;https://raw.githubusercontent.com/haslie22/kiddo-kingdom-data/data/images/games/railways/GR7-3.jpg;https://raw.githubusercontent.com/haslie22/kiddo-kingdom-data/data/images/games/railways/GR7-4.jpg
main,Games>Railways,1,GR8,GR8,GR8,brioworld,33061 Cargo Harbor Set,,,,"The Cargo Harbor Set comes with 16 pieces including a train, crane, tracks, ship and more.

Start your budding train engineer off on the right track or expand your collection with a Cargo Harbor Set. It’s the perfect gift at Christmas or over the holiday season for the creative toddler - designed for ages 3 and up.

As your child develops, so can their railway play as the Cargo Harbor Set is compatible with all other BRIO railway toys.

Playing with train sets helps children to understand and learn about their environment in a fun way, and the train functions help improve a child’s spatial awareness and fine motor skills.

We conduct more than 1,000 safety tests a year to ensure that our products conform to all safety standards, and we take pride in developing toys that are completely safe for children to play with.",6-12,EUR 7200;US-USD 8000,https://raw.githubusercontent.com/haslie22/kiddo-kingdom-data/data/images/games/railways/GR8-1.jpg;https://raw.githubusercontent.com/haslie22/kiddo-kingdom-data/data/images/games/railways/GR8-2.jpg;https://raw.githubusercontent.com/haslie22/kiddo-kingdom-data/data/images/games/railways/GR8-3.jpg;https://raw.githubusercontent.com/haslie22/kiddo-kingdom-data/data/images/games/railways/GR8-4.jpg
main,Books>Hard-covered books,1,BHC1,BHC1,BHC1,editionsamaterra,Rue de la peur,,,,"A scrapbook with cut-outs and flip-outs, full of humour and fun, for children aged 3-6
In a street inhabited by monsters, a grandfather teaches his granddaughter not to trust her looks! Attitudes towards differences and tolerance, treated with humour.

The book reveals a seemingly creepy street inhabited by a cerberus, a cyclops, a minotaur, a spear... which we discover when we open the doors and windows of our homes. A little girl, a little frightened, has to walk along this house to reach her grandfather. He teaches her that behind every monster is a sensitive soul.

The message of the filmmakers encourages children (and adults) to ask themselves more questions about appearance, which can (sometimes) be deceiving. In fact, to uncover the true personality of the inhabitants, readers of little∙e∙s will have to keep a cool head and walk backwards on the sidewalk.

Although Rue de la peur is, at first sight, a creepy children's book, it contains concepts of tolerance, difference, tenderness and humour.",6-12,EUR 1900;US-USD 2100,https://raw.githubusercontent.com/haslie22/kiddo-kingdom-data/data/images/books/hard-covered-books/BHC1-1.jpeg;https://raw.githubusercontent.com/haslie22/kiddo-kingdom-data/data/images/books/hard-covered-books/BHC1-2.jpeg;https://raw.githubusercontent.com/haslie22/kiddo-kingdom-data/data/images/books/hard-covered-books/BHC1-3.jpeg;https://raw.githubusercontent.com/haslie22/kiddo-kingdom-data/data/images/books/hard-covered-books/BHC1-4.jpeg
main,Books>Hard-covered books,1,BHC2,BHC2,BHC2,editionsamaterra,Kitty! Kitty?,,,,"Minou Minou has not been home for several days! Paul and Rita are worried and go looking for him in the neighborhood. The young reader is invited to help them in their quest, and finds himself in a market, a museum, a cinema, a pet store, a haunted house.

Minou Minou is a trickster! He loves to hide!
The cutouts of the windows and roofs energize the route and the passage from the outside to the inside of the various buildings, and accentuate the playful side of the research.

The cutouts of the cardboard pages allow you to go sometimes inside, sometimes outside the explored buildings and the children love it! ""KITTY! KITTY?"" is a playbook packed with details as we like them!",6-12,EUR 1800;US-USD 2000,https://raw.githubusercontent.com/haslie22/kiddo-kingdom-data/data/images/books/hard-covered-books/BHC2-1.jpeg;https://raw.githubusercontent.com/haslie22/kiddo-kingdom-data/data/images/books/hard-covered-books/BHC2-2.jpeg;https://raw.githubusercontent.com/haslie22/kiddo-kingdom-data/data/images/books/hard-covered-books/BHC2-3.jpeg;https://raw.githubusercontent.com/haslie22/kiddo-kingdom-data/data/images/books/hard-covered-books/BHC2-4.jpeg
main,Books>Hard-covered books,1,BHC3,BHC3,BHC3,editionsamaterra,Labyrinths,,,,"Sixteen magnificent labyrinths, from the simplest to the most complicated, at different times and in various universes, plant, animal, futuristic, architectural, festive.

“his book offers the main merit of approaching a slew of diversities and this, in a very complementary way: diversity of the levels of difficulty according to the width, the length and the arrangement of the borrowed paths, diversity of the framing with flat versions and 'others in perspective, diversity of the themes addressed and therefore of the places represented, diversity of the motivations for making the trip.

Explore worlds made of plants, giant skyscrapers, wild habitats, and futuristic cities, in this book that asks you to trace
your way through 14 magical mazes. With things to spot along the way, each maze grows in complexity with every turn of the page.",6-12,EUR 1900;US-USD 2100,https://raw.githubusercontent.com/haslie22/kiddo-kingdom-data/data/images/books/hard-covered-books/BHC3-1.jpeg;https://raw.githubusercontent.com/haslie22/kiddo-kingdom-data/data/images/books/hard-covered-books/BHC3-2.jpeg;https://raw.githubusercontent.com/haslie22/kiddo-kingdom-data/data/images/books/hard-covered-books/BHC3-13jpeg;https://raw.githubusercontent.com/haslie22/kiddo-kingdom-data/data/images/books/hard-covered-books/BHC3-4.jpeg
main,Books>Hard-covered books,1,BHC4,BHC4,BHC4,editionsamaterra,MiamMiam!,,,,"A funny and colorful card stock, with a zipper on each page, to create a surprise and discover what animals eat.",6-12,EUR 1400;US-USD 1600,https://raw.githubusercontent.com/haslie22/kiddo-kingdom-data/data/images/books/hard-covered-books/BHC4-1.jpeg;https://raw.githubusercontent.com/haslie22/kiddo-kingdom-data/data/images/books/hard-covered-books/BHC4-2.jpeg;https://raw.githubusercontent.com/haslie22/kiddo-kingdom-data/data/images/books/hard-covered-books/BHC4-3.jpeg;https://raw.githubusercontent.com/haslie22/kiddo-kingdom-data/data/images/books/hard-covered-books/BHC4-4.jpeg
