productType,categories,variantId,sku,key,slug.en,brand,name.en,metaTitle.en,metaDescription.en,metaKeywords.en,description.en,age-range,prices,images
main,Books>Hard-covered books,1,BHC5,BHC5,BHC5,moulinroty,Magic brush painting Dans la Jungle,,,,"Use this water-filled magic paintbrush to fill in the white areas on each page and watch the exotic jungle illustrations appear as if by magic! They can be used again and again, as the drawings disappear once they are dry!",3-6,EUR 1600;US-USD 1800,https://raw.githubusercontent.com/haslie22/kiddo-kingdom-data/data/images/books/hard-covered-books/BHC5-1.jpeg;https://raw.githubusercontent.com/haslie22/kiddo-kingdom-data/data/images/books/hard-covered-books/BHC5-2.jpeg;https://raw.githubusercontent.com/haslie22/kiddo-kingdom-data/data/images/books/hard-covered-books/BHC5-3.jpeg;https://raw.githubusercontent.com/haslie22/kiddo-kingdom-data/data/images/books/hard-covered-books/BHC5-4.jpeg
main,Books>Soft books,1,BS1,BS1,BS1,mykiddyshop,Activity book 1-3 years,,,,"French brand material book for kids from 1 to 3 years old. Helps the child's psychomotor development and education. It includes six stimulating early learning games, perfect for children of this age. The toddler learns to count, to understand different sizes and geometric shapes, and to learn useful skills such as dressing up, all in a Montessori way through play.",0-3,EUR 3900;US-USD 4300,https://raw.githubusercontent.com/haslie22/kiddo-kingdom-data/data/images/books/soft-books/BS1-1.jpeg;https://raw.githubusercontent.com/haslie22/kiddo-kingdom-data/data/images/books/soft-books/BS1-2.jpeg;https://raw.githubusercontent.com/haslie22/kiddo-kingdom-data/data/images/books/soft-books/BS1-3.jpeg;https://raw.githubusercontent.com/haslie22/kiddo-kingdom-data/data/images/books/soft-books/BS1-4.jpeg
main,Books>Soft books,1,BS2,BS2,BS2,mykiddyshop,Activity book 3-6 years,,,,"French brand material book for toddlers from 3 to 6 years old. Helps the child's psychomotor development and education. It includes six stimulating early learning games, perfect for children of this age. The child learns to count, to understand different sizes and geometric shapes, and to learn useful skills such as understanding how a clock works, all in a Montessori way through play.",3-6,EUR 3900;US-USD 4300,https://raw.githubusercontent.com/haslie22/kiddo-kingdom-data/data/images/books/soft-books/BS2-1.jpeg;https://raw.githubusercontent.com/haslie22/kiddo-kingdom-data/data/images/books/soft-books/BS2-2.jpeg;https://raw.githubusercontent.com/haslie22/kiddo-kingdom-data/data/images/books/soft-books/BS2-3.jpeg;https://raw.githubusercontent.com/haslie22/kiddo-kingdom-data/data/images/books/soft-books/BS2-4.jpeg
main,Stationery>Coloring books,1,SCB1,SCB1,SCB1,omy,Kawaii Paint Box,,,,"Irresistible illustrations inspired from the Japanese Kawaii Universe, a small world overflowing with fantasy.

Everything is included in the kit: 1 paint brush, 6 acrylic paint containers, includes 2 neon colors, 6 decorative pendants and 1 string.

Follow the numbers on illustration to paint with the right colors.

Once your artwork is completed, hang your small decorative pendant or gift it.",3-6,EUR 2200;US-USD 2500,https://raw.githubusercontent.com/haslie22/kiddo-kingdom-data/data/images/stationery/coloring-books/SCB1-1.jpeg;https://raw.githubusercontent.com/haslie22/kiddo-kingdom-data/data/images/stationery/coloring-books/SCB1-2.jpeg;https://raw.githubusercontent.com/haslie22/kiddo-kingdom-data/data/images/stationery/coloring-books/SCB1-3.jpeg;https://raw.githubusercontent.com/haslie22/kiddo-kingdom-data/data/images/stationery/coloring-books/SCB1-4.jpeg
main,Stationery>Coloring books,1,SCB2,SCB2,SCB2,omy,Dinos Paint Box,,,,"Play, paint and decorate!
The dinosaurs are coming to you, create your favorite decorative pendants with the paint box kit
Everything is included in the kit: 1 paint brush, 6 acrylic paint containers, includes one neon color, 6 decorative pendants and 1 string.

Follow the numbers on illustration to paint with the right colors.
once your artwork is completed, hang your small decorative pendant or gift it.",3-6,EUR 2200;US-USD 2500,https://raw.githubusercontent.com/haslie22/kiddo-kingdom-data/data/images/stationery/coloring-books/SCB2-1.jpeg;https://raw.githubusercontent.com/haslie22/kiddo-kingdom-data/data/images/stationery/coloring-books/SCB2-2.jpeg;https://raw.githubusercontent.com/haslie22/kiddo-kingdom-data/data/images/stationery/coloring-books/SCB2-3.jpeg;https://raw.githubusercontent.com/haslie22/kiddo-kingdom-data/data/images/stationery/coloring-books/SCB2-4.jpeg
main,Stationery>Coloring books,1,SCB3,SCB3,SCB3,omy,Dino Pocket Games,,,,"The travellers favorite coloring game to slip in every bag and take anywhere: in trains, retaurants, or planes.

Travel the world with this clever 3 ft long pocket game, filled with clues, activities and coloring + 1 multicolor crayon.

The rules are translated into 6 languages, and coloring pages can be torn along the dotted lines to make sharing and storing easier!",3-6,EUR 800;US-USD 900,https://raw.githubusercontent.com/haslie22/kiddo-kingdom-data/data/images/stationery/coloring-books/SCB3-1.jpeg;https://raw.githubusercontent.com/haslie22/kiddo-kingdom-data/data/images/stationery/coloring-books/SCB3-2.jpeg;https://raw.githubusercontent.com/haslie22/kiddo-kingdom-data/data/images/stationery/coloring-books/SCB3-3.jpeg;https://raw.githubusercontent.com/haslie22/kiddo-kingdom-data/data/images/stationery/coloring-books/SCB3-4.jpeg
main,Stationery>Coloring books,1,SCB4,SCB4,SCB4,ferflex,Coloring magnet set Dans l'Espace,,,,"The ""in space"" coloring magnets is a Creative Game for little budding explorers! Launch of rockets, asteroids, planets, astronauts and friendly aliens, your child will be able to bring his coloring pages to life and tell a thousand and one stories!

The ""in space"" coloring magnets come with 6 markers for endless erasing and starting.

These magnetic shapes can be attached to all magnetic surfaces in the house (magnetic wallpaper, magnetic chalkboard or slate, a fridge) and easily match the decoration of a child's room.",3-6,EUR 2800;US-USD 3100,https://raw.githubusercontent.com/haslie22/kiddo-kingdom-data/data/images/stationery/coloring-books/SCB4-1.jpeg;https://raw.githubusercontent.com/haslie22/kiddo-kingdom-data/data/images/stationery/coloring-books/SCB4-2.jpeg;https://raw.githubusercontent.com/haslie22/kiddo-kingdom-data/data/images/stationery/coloring-books/SCB4-3.jpeg;https://raw.githubusercontent.com/haslie22/kiddo-kingdom-data/data/images/stationery/coloring-books/SCB4-4.jpeg
main,Stationery>Coloring books,1,SCB5,SCB5,SCB5,ferflex,Coloring magnet set Dans la Foret,,,,"Set of 57 coloring magnets on the theme of the forest. Ideal for developing the creativity of children who can tell a thousand and one stories by placing their creations on any magnetic medium.

The ""in the forest"" coloring magnets come with 6 markers for endless erasing and starting.

These magnetic shapes can be attached to all magnetic surfaces in the house (magnetic wallpaper, magnetic chalkboard or slate, a fridge) and easily match the decoration of a child's room.",3-6,EUR 2800;US-USD 3100,https://raw.githubusercontent.com/haslie22/kiddo-kingdom-data/data/images/stationery/coloring-books/SCB5-1.jpeg;https://raw.githubusercontent.com/haslie22/kiddo-kingdom-data/data/images/stationery/coloring-books/SCB5-2.jpeg;https://raw.githubusercontent.com/haslie22/kiddo-kingdom-data/data/images/stationery/coloring-books/SCB5-3.jpeg;https://raw.githubusercontent.com/haslie22/kiddo-kingdom-data/data/images/stationery/coloring-books/SCB5-4.jpeg
main,Stationery>Coloring books,1,SCB6,SCB6,SCB6,lesdrolesdebouilles,Coloring table L'Atelier des Artistes,,,,"Created with teachers, this Coloritable offers several workshops.

First of all a Welcome workshop with the emotions, the weather, the seasons and the days of the week. Then a writing workshop for the first letters and words of your children. Finally, a cipher workshop to learn to recognize them, write them down and count them. In the center of the table we have put a goose game board for even more fun.

The table is colored using water-based and ultra-erasable markers and then erased with a damp cloth. 1 set of 12 markers is included with the table as well as 4 pawns and 1 die.",3-6,EUR 11900;US-USD 13100,https://raw.githubusercontent.com/haslie22/kiddo-kingdom-data/data/images/stationery/coloring-books/SCB6-1.jpeg;https://raw.githubusercontent.com/haslie22/kiddo-kingdom-data/data/images/stationery/coloring-books/SCB6-2.jpeg;https://raw.githubusercontent.com/haslie22/kiddo-kingdom-data/data/images/stationery/coloring-books/SCB6-3.jpeg;https://raw.githubusercontent.com/haslie22/kiddo-kingdom-data/data/images/stationery/coloring-books/SCB6-4.jpeg
main,Stationery>Coloring books,1,SCB7,SCB7,SCB7,lesdrolesdebouilles,Coloring table La Forêt,,,,"What if it was finally possible to write, color and draw on a table?

We made that childhood dream come true with the Coloritable - the first infinity coloring table. This La Balade en Forêt model will take you to discover the flora and fauna of the forest through the 4 seasons. While Jamy is making a herbarium, Nico plants a tree and Bree takes care of the hibernation of the bears.

Perfect for developing language and interactions with children, this adventure can be colored alone or with others with the 4 sides facing the child. The markers to use are simple water-based and ultra-erasable markers. 1 set of 12 markers is included with the table.

Suitable for ages 3 to 9.",3-6,EUR 11900;US-USD 13100,https://raw.githubusercontent.com/haslie22/kiddo-kingdom-data/data/images/stationery/coloring-books/SCB7-1.jpeg;https://raw.githubusercontent.com/haslie22/kiddo-kingdom-data/data/images/stationery/coloring-books/SCB7-2.jpeg;https://raw.githubusercontent.com/haslie22/kiddo-kingdom-data/data/images/stationery/coloring-books/SCB7-3.jpeg;https://raw.githubusercontent.com/haslie22/kiddo-kingdom-data/data/images/stationery/coloring-books/SCB7-4.jpeg
main,Stationery>Pens and markers,1,SPM1,SPM1,SPM1,omy,Magical pens set,,,,"These magic felt pens can erase or change color with the help of two special white pens included in the packaging.
Double-tipped.

The box becomes a pretty pencil holder for your desk or office.",3-6,EUR 1400;US-USD 1600,https://raw.githubusercontent.com/haslie22/kiddo-kingdom-data/data/images/stationery/pens-and-markers/SPM1-1.jpeg;https://raw.githubusercontent.com/haslie22/kiddo-kingdom-data/data/images/stationery/pens-and-markers/SPM1-2.jpeg;https://raw.githubusercontent.com/haslie22/kiddo-kingdom-data/data/images/stationery/pens-and-markers/SPM1-3.jpeg;https://raw.githubusercontent.com/haslie22/kiddo-kingdom-data/data/images/stationery/pens-and-markers/SPM1-4.jpeg
main,Stationery>Pens and markers,1,SPM2,SPM2,SPM2,omy,Colored pencils set,,,,"OMY Make coloring extra fun with these bright and neon colored pencils

16 assorted colors : 10 neons and 6 shiny colors.
The box becomes a pretty pencil holder for your desk or office.",3-6,EUR 1200;US-USD 1400,https://raw.githubusercontent.com/haslie22/kiddo-kingdom-data/data/images/stationery/pens-and-markers/SPM2-1.jpeg;https://raw.githubusercontent.com/haslie22/kiddo-kingdom-data/data/images/stationery/pens-and-markers/SPM2-2.jpeg;https://raw.githubusercontent.com/haslie22/kiddo-kingdom-data/data/images/stationery/pens-and-markers/SPM2-3.jpeg;https://raw.githubusercontent.com/haslie22/kiddo-kingdom-data/data/images/stationery/pens-and-markers/SPM2-4.jpeg
main,Stationery>Pens and markers,1,SPM3,SPM3,SPM3,omy,Ultrawashable jumbo felt pens set,,,,"Jumbo markers for mini kids!
9 markers easy told hold with giant tips, perfect for coloring and drawing on large surfaces (line thickness: 2 - 12 mm)

Washable ink that doesn’t stain hands or clothes.

Conveniently, the box transforms into a marker holder!",3-6,EUR 1800;US-USD 2000,https://raw.githubusercontent.com/haslie22/kiddo-kingdom-data/data/images/stationery/pens-and-markers/SPM3-1.jpeg;https://raw.githubusercontent.com/haslie22/kiddo-kingdom-data/data/images/stationery/pens-and-markers/SPM3-2.jpeg;https://raw.githubusercontent.com/haslie22/kiddo-kingdom-data/data/images/stationery/pens-and-markers/SPM3-3.jpeg;https://raw.githubusercontent.com/haslie22/kiddo-kingdom-data/data/images/stationery/pens-and-markers/SPM3-4.jpeg
main,Stationery>Pens and markers,1,SPM4,SPM4,SPM4,omy,Glitter markers set,,,,"Markers with glitters to make your drawings sparkle!
The vibrant colors make the coloring sparkle with the glitters mixed into the ink.

The assortment of durable and waterproof 9 color markers work on all papers and surfaces.
Conveniently, the box transforms into an at home crayon holder!",3-6,EUR 1700;US-USD 1900,https://raw.githubusercontent.com/haslie22/kiddo-kingdom-data/data/images/stationery/pens-and-markers/SPM4-1.jpeg;https://raw.githubusercontent.com/haslie22/kiddo-kingdom-data/data/images/stationery/pens-and-markers/SPM4-2.jpeg;https://raw.githubusercontent.com/haslie22/kiddo-kingdom-data/data/images/stationery/pens-and-markers/SPM4-3.jpeg;https://raw.githubusercontent.com/haslie22/kiddo-kingdom-data/data/images/stationery/pens-and-markers/SPM4-4.jpeg
main,Stationery>Posters,1,SP1,SP1,SP1,poppik,International stickers poster Football,,,,"A map of Europe of the most famous football clubs, for all football enthusiasts. To be completed with large stickers.

A poster for football fans! An easy and quick activity (around 30 minutes). An original, fun and design gift (Christmas, birthday). An easy-to-frame poster (standard frame 70 x 100 cm). Pocket dimensions: 22 x 35 cm.",6-12,EUR 1700;US-USD 1900,https://raw.githubusercontent.com/haslie22/kiddo-kingdom-data/data/images/stationery/posters/SP1-1.jpeg;https://raw.githubusercontent.com/haslie22/kiddo-kingdom-data/data/images/stationery/posters/SP1-2.jpeg;https://raw.githubusercontent.com/haslie22/kiddo-kingdom-data/data/images/stationery/posters/SP1-3.jpeg;https://raw.githubusercontent.com/haslie22/kiddo-kingdom-data/data/images/stationery/posters/SP1-4.jpeg
main,Stationery>Posters,1,SP2,SP2,SP2,poppik,International stickers poster Animaux du monde,,,,"An educational poster to discover the animals of the world. To be completed with large stickers.

An educational activity to discover the emblematic animals of each continent.
An easy and quick activity (about 30 minutes).

An original, playful and design gift (Christmas, birthday).
A poster that is easy to frame (standard frame 70 x 100 cm)",6-12,EUR 1700;US-USD 1900,https://raw.githubusercontent.com/haslie22/kiddo-kingdom-data/data/images/stationery/posters/SP2-1.jpeg;https://raw.githubusercontent.com/haslie22/kiddo-kingdom-data/data/images/stationery/posters/SP2-2.jpeg;https://raw.githubusercontent.com/haslie22/kiddo-kingdom-data/data/images/stationery/posters/SP2-3.jpeg;https://raw.githubusercontent.com/haslie22/kiddo-kingdom-data/data/images/stationery/posters/SP2-4.jpeg
main,Stationery>Posters,1,SP3,SP3,SP3,omy,EU Giant poster + 100 stickers Atlas,,,,"Decorate this giant coloring poster and travel the globe, the Pyramids in Egypt, the Statue of Liberty, the North Pole, Brazil, Easter Island, and many more!

With more than 100 stickers to search, find and stick.
A real graphic trip to share with a lot of humour and a multitude of details.",6-12,EUR 2200;US-USD 2500,https://raw.githubusercontent.com/haslie22/kiddo-kingdom-data/data/images/stationery/posters/SP3-1.jpeg;https://raw.githubusercontent.com/haslie22/kiddo-kingdom-data/data/images/stationery/posters/SP3-2.jpeg;https://raw.githubusercontent.com/haslie22/kiddo-kingdom-data/data/images/stationery/posters/SP3-3.jpeg;https://raw.githubusercontent.com/haslie22/kiddo-kingdom-data/data/images/stationery/posters/SP3-4.jpeg
main,Stationery>Posters,1,SP4,SP4,SP4,omy,EU Giant poster + 100 stickers Paris,,,,"Giant Paris map to decorate with stickers included!
A real graphic trip to share with a lot of humor and a multitude of details.",6-12,EUR 2200;US-USD 2500,https://raw.githubusercontent.com/haslie22/kiddo-kingdom-data/data/images/stationery/posters/SP4-1.jpeg;https://raw.githubusercontent.com/haslie22/kiddo-kingdom-data/data/images/stationery/posters/SP4-2.jpeg;https://raw.githubusercontent.com/haslie22/kiddo-kingdom-data/data/images/stationery/posters/SP4-3.jpeg;https://raw.githubusercontent.com/haslie22/kiddo-kingdom-data/data/images/stationery/posters/SP4-4.jpeg
main,Stationery>Posters,1,SP5,SP5,SP5,poppik,International stickers poster The House,,,,"On a 1 meter high poster, children stick stickers to complete a big house: they add furniture, accessories and characters. They add furniture, accessories and characters to complete a large house. 

We find the whole universe of the family of Graou, a funny little dog. All the imagery of everyday life in a poster.",6-12,EUR 1700;US-USD 1900,https://raw.githubusercontent.com/haslie22/kiddo-kingdom-data/data/images/stationery/posters/SP5-1.jpeg;https://raw.githubusercontent.com/haslie22/kiddo-kingdom-data/data/images/stationery/posters/SP5-2.jpeg;https://raw.githubusercontent.com/haslie22/kiddo-kingdom-data/data/images/stationery/posters/SP5-3.jpeg;https://raw.githubusercontent.com/haslie22/kiddo-kingdom-data/data/images/stationery/posters/SP5-4.jpeg
main,Stationery>Posters,1,SP6,SP6,SP6,doudous,Memory poster Affiches,,,,"A playful poster by the French brand MEMORY AFFICHES for your little ones' room. This poster will take your little ones to a dream world.

This poster features soft plush toys - vintage teddy bears, funny and adorable plush animals.

Your little ones will have fun searching for the pairs of plush toys hidden in this poster (each plush toy is repeated twice).
The DOUDOUS poster is printed in France on 250 g FSC certified paper.

Comes complete with wooden plaques (quickly transformed by magnets into a perfect frame).",6-12,EUR 2400;US-USD 2700,https://raw.githubusercontent.com/haslie22/kiddo-kingdom-data/data/images/stationery/posters/SP6-1.jpeg;https://raw.githubusercontent.com/haslie22/kiddo-kingdom-data/data/images/stationery/posters/SP6-2.jpeg;https://raw.githubusercontent.com/haslie22/kiddo-kingdom-data/data/images/stationery/posters/SP6-3.jpeg;https://raw.githubusercontent.com/haslie22/kiddo-kingdom-data/data/images/stationery/posters/SP6-4.jpeg
main,Stationery>Stickers,1,SS1,SS1,SS1,rainette,Reflective sticker Pep's,,,,"This awesome retro-reflective sticker can be stuck on any smooth surface!

Printed in France and resistant to water and UV, it will allow you to have your own style by day and be seen well at night!",6-12,EUR 1000;US-USD 1200,https://raw.githubusercontent.com/haslie22/kiddo-kingdom-data/data/images/stationery/stickers/SS1-1.jpeg;https://raw.githubusercontent.com/haslie22/kiddo-kingdom-data/data/images/stationery/stickers/SS1-2.jpeg;https://raw.githubusercontent.com/haslie22/kiddo-kingdom-data/data/images/stationery/stickers/SS1-3.jpeg;https://raw.githubusercontent.com/haslie22/kiddo-kingdom-data/data/images/stationery/stickers/SS1-4.jpeg
main,Stationery>Stickers,1,SS2,SS2,SS2,rainette,Reflective sticker Little Monsters,,,,"This awesome retro-reflective sticker can be stuck on any smooth surface!

Printed in France and resistant to water and UV, it will allow you to have your own style by day and be seen well at night!",6-12,EUR 1000;US-USD 1200,https://raw.githubusercontent.com/haslie22/kiddo-kingdom-data/data/images/stationery/stickers/SS2-1.jpeg;https://raw.githubusercontent.com/haslie22/kiddo-kingdom-data/data/images/stationery/stickers/SS2-2.jpeg;https://raw.githubusercontent.com/haslie22/kiddo-kingdom-data/data/images/stationery/stickers/SS2-3.jpeg;https://raw.githubusercontent.com/haslie22/kiddo-kingdom-data/data/images/stationery/stickers/SS2-4.jpeg
main,Stationery>Stickers,1,SS3,SS3,SS3,rainette,Reflective sticker Tree Frog,,,,"This awesome retro-reflective sticker can be stuck on any smooth surface!

Printed in France and resistant to water and UV, it will allow you to have your own style by day and be seen well at night!",6-12,EUR 1000;US-USD 1200,https://raw.githubusercontent.com/haslie22/kiddo-kingdom-data/data/images/stationery/stickers/SS3-1.jpeg;https://raw.githubusercontent.com/haslie22/kiddo-kingdom-data/data/images/stationery/stickers/SS3-2.png;https://raw.githubusercontent.com/haslie22/kiddo-kingdom-data/data/images/stationery/stickers/SS3-3.jpeg;https://raw.githubusercontent.com/haslie22/kiddo-kingdom-data/data/images/stationery/stickers/SS3-4.png
main,Stationery>Stickers,1,SS4,SS4,SS4,rainette,Reflective sticker Super Meow,,,,"This awesome retro-reflective sticker can be stuck on any smooth surface!

Printed in France and resistant to water and UV, it will allow you to have your own style by day and be seen well at night!",6-12,EUR 1000;US-USD 1200,https://raw.githubusercontent.com/haslie22/kiddo-kingdom-data/data/images/stationery/stickers/SS4-1.jpeg;https://raw.githubusercontent.com/haslie22/kiddo-kingdom-data/data/images/stationery/stickers/SS4-2.jpeg;https://raw.githubusercontent.com/haslie22/kiddo-kingdom-data/data/images/stationery/stickers/SS4-3.jpeg;https://raw.githubusercontent.com/haslie22/kiddo-kingdom-data/data/images/stationery/stickers/SS4-4.jpeg
main,Vehicles>Bikes,1,VB1,VB1,VB1,baghera,Balance bike with helmet,,,,"Discover our collection of balance bikes, designed for children from 3 to 5 years old, many elements of which give it a special look, such as its wicker basket or its imitation leather saddle and its adjustable handlebars

Bike comes with helmet.

More than toys, we design and produce balance bikes with the goal of developing motor skills in toddlers. The pedal-less bicycle allows children to instinctively understand how to move, turn and develop their balance while having fun.",3-6,EUR 16900;US-USD 18600,https://raw.githubusercontent.com/haslie22/kiddo-kingdom-data/data/images/vehicles/bikes/VB1-1.jpeg;https://raw.githubusercontent.com/haslie22/kiddo-kingdom-data/data/images/vehicles/bikes/VB1-2.jpeg;https://raw.githubusercontent.com/haslie22/kiddo-kingdom-data/data/images/vehicles/bikes/VB1-3.jpeg;https://raw.githubusercontent.com/haslie22/kiddo-kingdom-data/data/images/vehicles/bikes/VB1-4.jpeg
main,Vehicles>Bikes,1,VB2,VB2,VB2,rainette,Bike seat rain cape,,,,"Rainette's raincoat is the ideal equipment to protect your child from rain and wind.
Comfortable, practical and extremely useful, it won over parents and children alike!

Its advantages :
• sleeves, to allow the child to use his hands
• reflective strips so that everyone can see you.
• a hood big enough to hold a helmet
• sleeves wide enough to cover a coat
• heat-sealed seams to guarantee watertightness
• an integrated storage pocket
• ethical and sustainable production",3-6,EUR 5900;US-USD 6500,https://raw.githubusercontent.com/haslie22/kiddo-kingdom-data/data/images/vehicles/bikes/VB2-1.jpeg;https://raw.githubusercontent.com/haslie22/kiddo-kingdom-data/data/images/vehicles/bikes/VB2-2.jpeg;https://raw.githubusercontent.com/haslie22/kiddo-kingdom-data/data/images/vehicles/bikes/VB2-3.jpeg;https://raw.githubusercontent.com/haslie22/kiddo-kingdom-data/data/images/vehicles/bikes/VB2-4.jpeg
main,Vehicles>Bikes,1,VB3,VB3,VB3,monzoli,Baby helmet Bubblegum,,,,"Mon Zoli Helmet's mission is to make kids love their helmets!
These helmets can be personalized thanks to a sheet of stickers offered with the helmet and bringing together universes for young and old.

Helmets made in Portugal in exclusive and matte colors.
Stickers created by wonderful graphic designer and printed in France.
All that remains is to wish all your young customers great adventures: on a bike, scooter or skateboard.",3-6,EUR 3900;US-USD 4300,https://raw.githubusercontent.com/haslie22/kiddo-kingdom-data/data/images/vehicles/bikes/VB3-1.jpeg;https://raw.githubusercontent.com/haslie22/kiddo-kingdom-data/data/images/vehicles/bikes/VB3-2.jpeg;https://raw.githubusercontent.com/haslie22/kiddo-kingdom-data/data/images/vehicles/bikes/VB3-3.jpeg;https://raw.githubusercontent.com/haslie22/kiddo-kingdom-data/data/images/vehicles/bikes/VB3-4.jpeg
main,Vehicles>Bikes,1,VB4,VB4,VB4,monzoli,Baby helmet Mint,,,,"Mon Zoli Helmet's mission is to make kids love their helmets!
These helmets can be personalized thanks to a sheet of stickers offered with the helmet and bringing together universes for young and old.

Helmets made in Portugal in exclusive and matte colors.
Stickers created by wonderful graphic designer and printed in France.
All that remains is to wish all your young customers great adventures: on a bike, scooter or skateboard.",3-6,EUR 3900;US-USD 4300,https://raw.githubusercontent.com/haslie22/kiddo-kingdom-data/data/images/vehicles/bikes/VB4-1.jpeg;https://raw.githubusercontent.com/haslie22/kiddo-kingdom-data/data/images/vehicles/bikes/VB4-2.jpeg;https://raw.githubusercontent.com/haslie22/kiddo-kingdom-data/data/images/vehicles/bikes/VB4-3.jpeg;https://raw.githubusercontent.com/haslie22/kiddo-kingdom-data/data/images/vehicles/bikes/VB4-4.jpeg
