productType,categories,variantId,sku,key,slug.en,brand,name.en,metaTitle.en,metaDescription.en,metaKeywords.en,description.en,age-range,prices,images
main,Magnetic boards>Boards,1,MB1,MB1,MB1,ferflex,Magnetic wallpaper 2m x 58cm,,,,"Ferflex® dresses the walls by making them beautiful and practical with a range of magnetic wallpapers adapted to every need and every space. Our mission is to simplify your life, by offering you products that are easy to install, practical and decorative.

Create a display space that suits you with Ferflex: modular, durable, infinitely customizable!

Very easy to stick, thanks to its repositionable adhesive, Ferflex® magnetic wallpaper can be positioned on any perfectly smooth support: wall, door, glass, kitchen furniture, cupboard door, wooden board...

Ferflex® offers both decorative and useful products that are adopted by parents and validated by children.

All of our magnetic holders are compatible with all kinds of magnets.

To write on wallpaper, use a white liquid chalk marker or for children, we recommend the use of Stabilo Woody 3 in 1 pencils which are erased with a small cloth moistened with water. It is advisable to clean regularly after writing or drawing on its magnetic wallpaper. You can also use our magnetic slates for endless writing.

To clean it, it is advisable to use a soft microfiber type cloth to avoid scratching the surface. If there are stubborn marks, simply dampen the soft cloth, add a drop of washing-up liquid and rub, insisting on the marks.",6-12,EUR 7600;US-USD 8400,https://raw.githubusercontent.com/haslie22/kiddo-kingdom-data/data/images/magnetic-boards/boards/MB1-1.jpeg;https://raw.githubusercontent.com/haslie22/kiddo-kingdom-data/data/images/magnetic-boards/boards/MB1-2.jpeg;https://raw.githubusercontent.com/haslie22/kiddo-kingdom-data/data/images/magnetic-boards/boards/MB1-3.jpeg;https://raw.githubusercontent.com/haslie22/kiddo-kingdom-data/data/images/magnetic-boards/boards/MB1-4.jpeg
main,Magnetic boards>Boards,1,MB2,MB2,MB2,ferflex,Magnetic wallpaper 1mx60cm,,,,"Ferflex® dresses the walls by making them beautiful and practical with a range of magnetic wallpapers adapted to every need and every space. Our mission is to simplify your life, by offering you products that are easy to install, practical and decorative.

Create a display space that suits you with Ferflex: modular, durable, infinitely customizable!

The magnetic wallpaper is also available in other dimensions 60cm x 2m, 60cmx2m60.

Very easy to stick, thanks to its repositionable adhesive, Ferflex® magnetic wallpaper can be positioned on any perfectly smooth support: wall, door, glass, kitchen furniture, cupboard door, wooden board...

Ferflex® offers both decorative and useful products that are adopted by parents and validated by children.

All of our magnetic holders are compatible with all kinds of magnets.

To write on wallpaper, use a white liquid chalk marker or for children, we recommend the use of Stabilo Woody 3 in 1 pencils which are erased with a small cloth moistened with water. It is advisable to clean regularly after writing or drawing on its magnetic wallpaper. You can also use our magnetic slates for endless writing.

To clean it, it is advisable to use a soft microfiber type cloth to avoid scratching the surface. If there are stubborn marks, simply dampen the soft cloth, add a drop of washing-up liquid and rub, insisting on the marks.",6-12,EUR 5600;US-USD 6200,https://raw.githubusercontent.com/haslie22/kiddo-kingdom-data/data/images/magnetic-boards/boards/MB2-1.jpeg;https://raw.githubusercontent.com/haslie22/kiddo-kingdom-data/data/images/magnetic-boards/boards/MB2-2.jpeg;https://raw.githubusercontent.com/haslie22/kiddo-kingdom-data/data/images/magnetic-boards/boards/MB2-3.jpeg;https://raw.githubusercontent.com/haslie22/kiddo-kingdom-data/data/images/magnetic-boards/boards/MB2-4.jpeg
main,Magnetic boards>Boards,1,MB3,MB3,MB3,ferflex,Magnetic wallpaper 2.60mx60cm,,,,"Ferflex® dresses the walls by making them beautiful and practical with a range of magnetic wallpapers adapted to every need and every space. Our mission is to simplify your life, by offering you products that are easy to install, practical and decorative.

Create a display space that suits you with Ferflex: modular, durable, infinitely customizable!

Very easy to stick, thanks to its repositionable adhesive, Ferflex® magnetic wallpaper can be positioned on any perfectly smooth support: wall, door, glass, kitchen furniture, cupboard door, wooden board...

Ferflex® offers both decorative and useful products that are adopted by parents and validated by children.

All of our magnetic holders are compatible with all kinds of magnets.

To write on wallpaper, use a white liquid chalk marker or for children, we recommend the use of Stabilo Woody 3 in 1 pencils which are erased with a small cloth moistened with water. It is advisable to clean regularly after writing or drawing on its magnetic wallpaper. You can also use our magnetic slates for endless writing.

To clean it, it is advisable to use a soft microfiber type cloth to avoid scratching the surface. If there are stubborn marks, simply dampen the soft cloth, add a drop of washing-up liquid and rub, insisting on the marks.",6-12,EUR 8900;US-USD 9800,https://raw.githubusercontent.com/haslie22/kiddo-kingdom-data/data/images/magnetic-boards/boards/MB3-1.jpeg;https://raw.githubusercontent.com/haslie22/kiddo-kingdom-data/data/images/magnetic-boards/boards/MB3-2.jpeg;https://raw.githubusercontent.com/haslie22/kiddo-kingdom-data/data/images/magnetic-boards/boards/MB3-3.jpeg;https://raw.githubusercontent.com/haslie22/kiddo-kingdom-data/data/images/magnetic-boards/boards/MB3-4.jpeg
main,Magnetic boards>Boards,1,MB4,MB4,MB4,ferflex,Magnetic board Montagne,,,,"Want to make a mountain appear in a child's room or a playroom! The mountain magnetic board is a new source of inspiration, an invitation to escape! Puzzles, coloring, photos... you can magnetize everything on them! Plus, the child can also write or draw on it with liquid chalk felt.


The Montagne magnetic board consists of 3 flexible magnetic boards with a mat finish.

Dimensions of the mountain magnetic board: 118x92.5 cm
The central top: 60x60 cm
The highest peak: 55x92.5 cm
The intermediate top: 48.5x75 cm
Table thickness: 0.6mm

All of our magnetic holders are compatible with all kinds of magnets.

To write on wallpaper, use a white liquid chalk marker or for children, we recommend the use of Stabilo Woody 3 in 1 pencils which are erased with a small cloth moistened with water. It is advisable to clean regularly after writing or drawing on its magnetic wallpaper. You can also use our magnetic slates for endless writing.

To clean it, it is advisable to use a soft microfiber type cloth to avoid scratching the surface. If there are stubborn marks, simply dampen the soft cloth, add a drop of washing-up liquid and rub, insisting on the marks.",6-12,EUR 5900;US-USD 6500,https://raw.githubusercontent.com/haslie22/kiddo-kingdom-data/data/images/magnetic-boards/boards/MB4-1.jpeg;https://raw.githubusercontent.com/haslie22/kiddo-kingdom-data/data/images/magnetic-boards/boards/MB4-2.jpeg;https://raw.githubusercontent.com/haslie22/kiddo-kingdom-data/data/images/magnetic-boards/boards/MB4-3.jpeg;https://raw.githubusercontent.com/haslie22/kiddo-kingdom-data/data/images/magnetic-boards/boards/MB4-4.jpeg
main,Magnetic boards>Board accessories,1,MBA1,MBA1,MBA1,ferflex,Magnetic set Pastel,,,,"These magnetic and erasable reminders are perfect for listing your activities to do, jotting down appointments, and for leaving little messages to pass on to family or roommates.

In addition to their practicality, these magnetic reminders are also decorative!
They are positioned on all the metal surfaces of the house (fridge, metal door, board or magnetic wallpaper).

Sustainable ! Featuring a dry erase surface, write and rewrite on our magnetic sticky notes.

Lighten your mental load, by jotting down all ideas and thoughts on these magnetic sticky notes
Our mission is to make your life easier by offering you products that are simple to use, practical and decorative.",6-12,EUR 2600;US-USD 2900,https://raw.githubusercontent.com/haslie22/kiddo-kingdom-data/data/images/magnetic-boards/board-accessories/MBA1-1.jpeg;https://raw.githubusercontent.com/haslie22/kiddo-kingdom-data/data/images/magnetic-boards/board-accessories/MBA1-2.jpeg;https://raw.githubusercontent.com/haslie22/kiddo-kingdom-data/data/images/magnetic-boards/board-accessories/MBA1-3.jpeg;https://raw.githubusercontent.com/haslie22/kiddo-kingdom-data/data/images/magnetic-boards/board-accessories/MBA1-4.jpeg;
main,Magnetic boards>Board accessories,1,MBA2,MBA2,MBA2,ferflex,Magnetic set Fraise,,,,"These magnetic and erasable reminders are perfect for listing your activities to do, jotting down appointments, and for leaving little messages to pass on to family or roommates.

In addition to their practicality, these magnetic reminders are also decorative!
They are positioned on all the metal surfaces of the house (fridge, metal door, board or magnetic wallpaper).

Sustainable ! Featuring a dry erase surface, write and rewrite on our magnetic sticky notes.

Lighten your mental load, by jotting down all ideas and thoughts on these magnetic sticky notes
Our mission is to make your life easier by offering you products that are simple to use, practical and decorative.",6-12,EUR 2900;US-USD 3200,https://raw.githubusercontent.com/haslie22/kiddo-kingdom-data/data/images/magnetic-boards/board-accessories/MBA2-1.jpeg;https://raw.githubusercontent.com/haslie22/kiddo-kingdom-data/data/images/magnetic-boards/board-accessories/MBA2-2.jpeg;https://raw.githubusercontent.com/haslie22/kiddo-kingdom-data/data/images/magnetic-boards/board-accessories/MBA2-3.jpeg;https://raw.githubusercontent.com/haslie22/kiddo-kingdom-data/data/images/magnetic-boards/board-accessories/MBA2-4.jpeg
main,Magnetic boards>Board accessories,1,MBA3,MBA3,MBA3,ferflex,Woody Stabilo pencil set (3 colors),,,,"The Woody Stabilo pencil is the creative companion adopted and validated by both children and parents! Washable, this 3-in-1 pencil transforms all Ferflex® magnetic surfaces into a veritable artistic playground.

These pencils is suitable for writing on Ferflex® colored boards.

3 colors: black, white and blue.",3-6,EUR 1200;US-USD 1300,https://raw.githubusercontent.com/haslie22/kiddo-kingdom-data/data/images/magnetic-boards/board-accessories/MBA3-1.jpeg;https://raw.githubusercontent.com/haslie22/kiddo-kingdom-data/data/images/magnetic-boards/board-accessories/MBA3-2.jpeg;https://raw.githubusercontent.com/haslie22/kiddo-kingdom-data/data/images/magnetic-boards/board-accessories/MBA3-3.jpeg;https://raw.githubusercontent.com/haslie22/kiddo-kingdom-data/data/images/magnetic-boards/board-accessories/MBA3-4.jpeg
main,Magnetic boards>Board accessories,1,MBA4,MBA4,MBA4,ferflex,Magnet set Matin et Soir,,,,"With these magnets, the child will be able to approach the notion of autonomy and set up his little morning and evening routine. An ideal magnetic game to promote self-confidence and a sense of security.

Language — English.

FERFLEX® MORNING AND EVENING MAGNETIC RITUALS CONTAIN:
14 magnets for morning rituals (6x6 cm per magnet)
15 magnets for evening rituals (6x6 cm per magnet)
7 day of the week magnets",6-12,EUR 2400;US-USD 2700,https://raw.githubusercontent.com/haslie22/kiddo-kingdom-data/data/images/magnetic-boards/board-accessories/MBA4-1.jpeg;https://raw.githubusercontent.com/haslie22/kiddo-kingdom-data/data/images/magnetic-boards/board-accessories/MBA4-2.jpeg;https://raw.githubusercontent.com/haslie22/kiddo-kingdom-data/data/images/magnetic-boards/board-accessories/MBA4-3.jpeg;https://raw.githubusercontent.com/haslie22/kiddo-kingdom-data/data/images/magnetic-boards/board-accessories/MBA4-4.jpeg
main,Toys>Mobile toys,1,MT1,MT1,MT1,lesdeglingos,Activity toy Speculos the Tiger,,,,Discovering life while having fun with the Déglingos is cool! The whole range allows your child to wake up with different activities. Discover and explore while having fun!,0-3,EUR 2900;US-USD 3200,https://raw.githubusercontent.com/haslie22/kiddo-kingdom-data/data/images/toys/mobile-toys/MT1-1.jpeg;https://raw.githubusercontent.com/haslie22/kiddo-kingdom-data/data/images/toys/mobile-toys/MT1-2.jpeg;https://raw.githubusercontent.com/haslie22/kiddo-kingdom-data/data/images/toys/mobile-toys/MT1-3.jpeg;https://raw.githubusercontent.com/haslie22/kiddo-kingdom-data/data/images/toys/mobile-toys/MT1-4.jpeg
main,Toys>Mobile toys,1,MT2,MT2,MT2,lesdeglingos,Activity toy Muchachos the Llama,,,,"Discovering life while having fun with the Déglingos is cool!

Very funny Déglingos activity spiral and easy to hang on the cot or baby stroller: rustling paper, small mirror, vibrating object.",0-3,EUR 2900;US-USD 3200,https://raw.githubusercontent.com/haslie22/kiddo-kingdom-data/data/images/toys/mobile-toys/MT2-1.jpeg;https://raw.githubusercontent.com/haslie22/kiddo-kingdom-data/data/images/toys/mobile-toys/MT2-2.jpeg;https://raw.githubusercontent.com/haslie22/kiddo-kingdom-data/data/images/toys/mobile-toys/MT2-3.jpeg;https://raw.githubusercontent.com/haslie22/kiddo-kingdom-data/data/images/toys/mobile-toys/MT2-4.jpeg
main,Toys>Mobile toys,1,MT3,MT3,MT3,trousselier,Musical play mat Tapis d'Eveil,,,,"A wonderful French-style and extremely soft musical toddler play mat from Trousselier.

The ivory coloured educational mat with pink detailing and lots of educational and stimulating activities for your little one - flowers, a rabbit, a sheep, which they can touch and feel the textures while lying on the mat.
The mat is safe for babies and ideal for stimulating the senses - it has a rattle, different textures, hanging toys on the top and even a removable music box hidden in a cloud.

The mat can be used with or without the bows as a simple mat for babies.

Tips: Wash the fabric toys and the quilted mat at 30° in the washing machine without the spinner function. It is advisable to remove the musical toy in the cloud before putting it in the washing machine. The cloth-covered hoop can be cleaned with a damp cloth.",0-3,EUR 13900;US-USD 15300,https://raw.githubusercontent.com/haslie22/kiddo-kingdom-data/data/images/toys/mobile-toys/MT3-1.jpeg;https://raw.githubusercontent.com/haslie22/kiddo-kingdom-data/data/images/toys/mobile-toys/MT3-2.jpeg;https://raw.githubusercontent.com/haslie22/kiddo-kingdom-data/data/images/toys/mobile-toys/MT3-3.jpeg;https://raw.githubusercontent.com/haslie22/kiddo-kingdom-data/data/images/toys/mobile-toys/MT3-4.jpeg
main,Toys>Soft toys,1,ST1,ST1,ST1,lesdeglingos,Activity cube Melimelos La Biche,,,,"In his playpen or on a play mat, baby can have fun with his complete and original activity cube! To throw, nibble or shake, it's guaranteed fun! This activity toy is ideal for stimulating all the senses thanks to its mirror, its rustling paper, its rattle and its teething ring.",0-3,EUR 3200;US-USD 3600,https://raw.githubusercontent.com/haslie22/kiddo-kingdom-data/data/images/toys/soft-toys/ST1-1.jpeg;https://raw.githubusercontent.com/haslie22/kiddo-kingdom-data/data/images/toys/soft-toys/ST1-2.jpeg;https://raw.githubusercontent.com/haslie22/kiddo-kingdom-data/data/images/toys/soft-toys/ST1-3.jpeg;https://raw.githubusercontent.com/haslie22/kiddo-kingdom-data/data/images/toys/soft-toys/ST1-4.jpeg
main,Toys>Soft toys,1,ST2,ST2,ST2,lesdeglingos,Activity toy Jelekros Lion,,,,"A plush activity toy that is insanely cute! Thanks to all these original and colourful accessories: rattle, mirror, blotting paper, teething ring... And Jélékros will be able to accompany him on all his adventures!

Age: 0 to 18 months
A true playmate and sensory stimulator to gently discover and stimulate all the senses.",0-3,EUR 2900;US-USD 3200,https://raw.githubusercontent.com/haslie22/kiddo-kingdom-data/data/images/toys/soft-toys/ST2-1.jpeg;https://raw.githubusercontent.com/haslie22/kiddo-kingdom-data/data/images/toys/soft-toys/ST2-2.jpeg;https://raw.githubusercontent.com/haslie22/kiddo-kingdom-data/data/images/toys/soft-toys/ST2-3.png;https://raw.githubusercontent.com/haslie22/kiddo-kingdom-data/data/images/toys/soft-toys/ST2-4.png
main,Toys>Soft toys,1,ST3,ST3,ST3,lesdeglingos,Toy Octopus,,,,"Mommy Octopus 45cm long and her baby hiding under her head in a velcro pin.

Ideal for cuddling and creating a lot of stories.",3-6,EUR 2900;US-USD 3200,https://raw.githubusercontent.com/haslie22/kiddo-kingdom-data/data/images/toys/soft-toys/ST3-1.jpeg;https://raw.githubusercontent.com/haslie22/kiddo-kingdom-data/data/images/toys/soft-toys/ST3-2.jpeg;https://raw.githubusercontent.com/haslie22/kiddo-kingdom-data/data/images/toys/soft-toys/ST3-3.jpeg;https://raw.githubusercontent.com/haslie22/kiddo-kingdom-data/data/images/toys/soft-toys/ST3-4.jpeg
main,Toys>Soft toys,1,ST4,ST4,ST4,moulinroty,Mousse handkerchief comforter,,,,"The little chambray fabric mouse is dressed in floral fabric with a delicate little collar. She carries a soft toy, made from organic cotton muslin, in her hand for baby to cuddle up to - a sweet little character made from super soft fabric. The perfect pair!",0-3,EUR 2400;US-USD 2700,https://raw.githubusercontent.com/haslie22/kiddo-kingdom-data/data/images/toys/soft-toys/ST4-1.jpeg;https://raw.githubusercontent.com/haslie22/kiddo-kingdom-data/data/images/toys/soft-toys/ST4-2.jpeg;https://raw.githubusercontent.com/haslie22/kiddo-kingdom-data/data/images/toys/soft-toys/ST4-3.jpeg;https://raw.githubusercontent.com/haslie22/kiddo-kingdom-data/data/images/toys/soft-toys/ST4-4.jpeg
main,Toys>Soft toys,1,ST5,ST5,ST5,lesdeglingos,Toy Original Pomelos l'Autruche,,,,"Watch out for the tangy cocktail with this big oisos, I named Lady Pomelos!

On a basis of elegance, add a zest of madness, a touch of extravagance, a few drops of oddities then sprinkle all the funny stuff!
To consume vitos and without moderation because with it: there are no seeds!",3-6,EUR 2900;US-USD 3200,https://raw.githubusercontent.com/haslie22/kiddo-kingdom-data/data/images/toys/soft-toys/ST5-1.jpeg;https://raw.githubusercontent.com/haslie22/kiddo-kingdom-data/data/images/toys/soft-toys/ST5-2.jpeg;https://raw.githubusercontent.com/haslie22/kiddo-kingdom-data/data/images/toys/soft-toys/ST5-3.jpeg;https://raw.githubusercontent.com/haslie22/kiddo-kingdom-data/data/images/toys/soft-toys/ST5-4.jpeg
main,Toys>Soft toys,1,ST6,ST6,ST6,moulinroty,Plush toy Mouni Les Schmouks,,,,"Yellow Mouni in mustard-coloured fur, his long legs dressed in cream fur trousers with brown polka-dots, pink fleece shoes and a little black felt hat for a look that's totally loopy.
Machine washable at 30°C on wool cycle. No tumble dry.",6-12,EUR 4200;US-USD 4700,https://raw.githubusercontent.com/haslie22/kiddo-kingdom-data/data/images/toys/soft-toys/ST6-1.jpeg;https://raw.githubusercontent.com/haslie22/kiddo-kingdom-data/data/images/toys/soft-toys/ST6-2.jpeg;https://raw.githubusercontent.com/haslie22/kiddo-kingdom-data/data/images/toys/soft-toys/ST6-3.jpeg;https://raw.githubusercontent.com/haslie22/kiddo-kingdom-data/data/images/toys/soft-toys/ST6-4.jpeg
main,Toys>Soft toys,1,ST7,ST7,ST7,moulinroty,Plush toy Pidou Les Schmouks,,,,"Pidou in orange fleece, amusingly comical with his big nose in fur fabric and his tousled hair. Wearing a blue and white striped jersey T-shirt and little boots in mustard-coloured fur for a look that's totally laid-back!
Machine washable at 30°C on wool cycle. No tumble dry.",6-12,EUR 4500;US-USD 5000,https://raw.githubusercontent.com/haslie22/kiddo-kingdom-data/data/images/toys/soft-toys/ST7-1.jpeg;https://raw.githubusercontent.com/haslie22/kiddo-kingdom-data/data/images/toys/soft-toys/ST7-2.jpeg;https://raw.githubusercontent.com/haslie22/kiddo-kingdom-data/data/images/toys/soft-toys/ST7-3.jpeg;https://raw.githubusercontent.com/haslie22/kiddo-kingdom-data/data/images/toys/soft-toys/ST7-4.jpeg
main,Toys>Soft toys,1,ST8,ST8,ST8,moulinroty,Plush toy Choukette Les Schmouks,,,,"Choukette, a little bundle of long blue hair that's totally messed up. Comical and mischievous he is totally in line with the wonderfully eccentric style of all the other Schmouks.",6-12,EUR 3200;US-USD 3600,https://raw.githubusercontent.com/haslie22/kiddo-kingdom-data/data/images/toys/soft-toys/ST8-1.jpeg;https://raw.githubusercontent.com/haslie22/kiddo-kingdom-data/data/images/toys/soft-toys/ST8-2.jpeg;https://raw.githubusercontent.com/haslie22/kiddo-kingdom-data/data/images/toys/soft-toys/ST8-3.jpeg;https://raw.githubusercontent.com/haslie22/kiddo-kingdom-data/data/images/toys/soft-toys/ST8-4.jpeg
main,Toys>Soft toys,1,ST9,ST9,ST9,lesdeglingos,Activity cube Speculos Le Tigre,,,,"In his playpen or on a play mat, baby can have fun with his complete and original activity cube! To throw, nibble or shake, it's guaranteed fun! This activity toy is ideal for stimulating all the senses thanks to its mirror, its rustling paper, its rattle and etc.

Little extra: Recycled polyester padding",0-3,EUR 3200;US-USD 3600,https://raw.githubusercontent.com/haslie22/kiddo-kingdom-data/data/images/toys/soft-toys/ST9-1.jpeg;https://raw.githubusercontent.com/haslie22/kiddo-kingdom-data/data/images/toys/soft-toys/ST9-2.jpeg;https://raw.githubusercontent.com/haslie22/kiddo-kingdom-data/data/images/toys/soft-toys/ST9-3.jpeg;https://raw.githubusercontent.com/haslie22/kiddo-kingdom-data/data/images/toys/soft-toys/ST9-4.jpeg
main,Toys>Soft toys,1,ST10,ST10,ST10,lesdeglingos,Activity cube Chillos le Paresseux,,,,"In his playpen or on a play mat, baby can have fun with his complete and original activity cube! To throw, nibble or shake, it's guaranteed fun! This activity toy is ideal for stimulating all the senses thanks to its mirror, its rustling paper, its rattle and etc.

Little extra: Recycled polyester padding",0-3,EUR 3200;US-USD 3600,https://raw.githubusercontent.com/haslie22/kiddo-kingdom-data/data/images/toys/soft-toys/ST10-1.jpeg;https://raw.githubusercontent.com/haslie22/kiddo-kingdom-data/data/images/toys/soft-toys/ST10-2.jpeg;https://raw.githubusercontent.com/haslie22/kiddo-kingdom-data/data/images/toys/soft-toys/ST10-3.jpeg;https://raw.githubusercontent.com/haslie22/kiddo-kingdom-data/data/images/toys/soft-toys/ST10-4.jpeg
main,Toys>Wooden toys,1,WT1,WT1,WT1,moulinroty,Caravan La Grande Famille,,,,"Moulin Roty's big family has decided to go on holiday with its caravan and they plan it all! This lovely wooden toy is composed by a vehicle (19 cm long) and inside it includes everything you need: a bed, a dining table with two chairs, fixed parasol and a oven with hob. The roof of the cabin can be removed and the door can be opened. So colorful, the caravan is decorated with pennants, flowers, awning, lamp, while red and white checkered curtains hang in the window.

Suitable for children 3+ years, it is the ideal dimension for their little hands. Perfect to invent stories.

Every Moulin Roty toy is tested and approved in compliance with the European standard NF-EN71 concerning flammability and migration of heavy metals. 

Any plastic part is tested to make sure that is pthalate-free while the textile are tested to be free from any substance which could be a problem for baby's skin.

The wood, especially beechwood, comes from sustainable forests

The dyes are tested and non-toxic",3-6,EUR 4600;US-USD 5100,https://raw.githubusercontent.com/haslie22/kiddo-kingdom-data/data/images/toys/wooden-toys/WT1-1.jpeg;https://raw.githubusercontent.com/haslie22/kiddo-kingdom-data/data/images/toys/wooden-toys/WT1-2.jpeg;https://raw.githubusercontent.com/haslie22/kiddo-kingdom-data/data/images/toys/wooden-toys/WT1-3.jpeg;https://raw.githubusercontent.com/haslie22/kiddo-kingdom-data/data/images/toys/wooden-toys/WT1-4.jpeg
main,Toys>Wooden toys,1,WT2,WT2,WT2,moulinroty,Tree house La Grande Famille,,,,"So many stories to tell with this tree house of the La grande famille collection created by Moulin Roty! The nature-decorated wooden house in light, solid wood is located on a tree with spiral staircase. And more: the toy includes a swing, rope ladder, bridge from tree to cabin and a lovely dining area with table, chairs and parasol. Your characters will enjoy a lot in this two floors! And at the top the roof is partially open for a telescope!

Ideal for kids from 3 years, it has rounded edges and the dimension is ideal for little hands. Perfect to encourage to tell stories.

Every Moulin Roty toy is tested and approved in compliance with the European standard NF-EN71 concerning flammability and migration of heavy metals. 

Any plastic part is tested to make sure that is pthalate-free while the textile are tested to be free from any substance which could be a problem for baby's skin.

The wood, especially beechwood, comes from sustainable forests

The dyes are tested and non-toxic",3-6,EUR 11900;US-USD 13100,https://raw.githubusercontent.com/haslie22/kiddo-kingdom-data/data/images/toys/wooden-toys/WT2-1.jpeg;https://raw.githubusercontent.com/haslie22/kiddo-kingdom-data/data/images/toys/wooden-toys/WT2-2.jpeg;https://raw.githubusercontent.com/haslie22/kiddo-kingdom-data/data/images/toys/wooden-toys/WT2-3.jpeg;https://raw.githubusercontent.com/haslie22/kiddo-kingdom-data/data/images/toys/wooden-toys/WT2-4.jpeg
